<?xml version="1.0" encoding="UTF-8"?>
<PluginManifest xmlns="http://www.opencpn.org/pluginmanager/OpenCPNPluginManager/PluginManifest"
 xmlns:xsi="http://www.w3.org/2001/XMLSchema-instance"
 xsi:schemaLocation="http://www.opencpn.org/pluginmanager/OpenCPNPluginManager/PluginManifest OpenCPNPluginManager.PluginManifest.xsd"
 Version="1"
 Name="test_pi"
 IconUrl="http://www.tempuri.org/32x32.png"
 ScreenshotUrl="http://www.tempuri.org/screenshot.png"
 HomepageUrl="http://www.tempuri.org/"
 Author="Author1"
 ReleaseDate="2006-05-04T18:13:51.0"
 VersionMajor="1"
 VersionMinor="1"
 APILevelMajor="1"
 APILevelMinor="10">
    <PluginName>Test Plug-in</PluginName>
    <Description>This is a description of the plug-in</Description>
    <CommonData Url="http://www.tempuri.org/data.xz" Size="100000" Checksum="ec727fd34069730a61cd0a86027989c2">
        <PostInstallMessage>Plug-in was successfully installed</PostInstallMessage>
    </CommonData>
    <CommonData Url="http://www.tempuri.org/data1.xz" Size="100000" Checksum="ec727fd34069730a61cd0a86027989c2" Description="More detailed data"/>
    <PlatformData Platform="Windows" Url="http://www.tempuri.org/win.xz" Size="10000" Checksum="ec727fd34069730a61cd0a86027989c2">
        <PostInstallAction>dir C:</PostInstallAction>
        <PostInstallAction>dir D:</PostInstallAction>
        <PostInstallMessage>Running on Windows</PostInstallMessage>
    </PlatformData>
    <PlatformData Platform="Linux32" Url="http://www.tempuri.org/l32.xz" Size="10000" Checksum="ec727fd34069730a61cd0a86027989c2">
        <PostInstallAction>ls -la /</PostInstallAction>
    </PlatformData>
    <PlatformData Platform="Linux64" Url="http://www.tempuri.org/l64.xz" Size="10000" Checksum="ec727fd34069730a61cd0a86027989c2">
        <PostInstallAction>ls -la /</PostInstallAction>
        <PostInstallMessage>Running on 64-bit X86 Linux</PostInstallMessage>
    </PlatformData>
    <PlatformData Platform="LinuxArmHf" Url="http://www.tempuri.org/larmhf.xz" Size="10000" Checksum="ec727fd34069730a61cd0a86027989c2">
        <PostInstallAction>ls -la /</PostInstallAction>
        <PostInstallMessage>Running on ARM Linux</PostInstallMessage>
    </PlatformData>
    <PlatformData Platform="Mac" Url="http://www.tempuri.org/mac.xz" Size="11000" Checksum="ec727fd34069730a61cd0a86027989c2">
        <PostInstallMessage>Running on Mac OS X</PostInstallMessage>
    </PlatformData>
    <Dependency Type="Recommended" Plugin="grib_pi" />
    <Dependency Type="Required" Plugin="dashboard_pi" MinimalVersionMajor="1" MinimalVersionMinor="2"/>
</PluginManifest>
